{
  "name": "Food Delivery App",
  "budget_inr_per_month": 50000,
  "description": "Building a food delivery app for 10,000 users per month",
  "tech_stack": {
    "backend": "Node.js",
    "database": "PostgreSQL",
    "storage": "Object storage",
    "monitoring": "Monitoring",
    "analytics": "Basic analytics"
  },
  "non_functional_requirements": [
    "Scalability",
    "Cost efficiency",
    "Uptime monitoring"
  ]
}